<?xml version="1.0"?>
<?xml-stylesheet type="text/xsl" href="../style.xsl"?>

<technique name="repeating mace" level="orange" category="push"
 xmlns:xsi="http://www.w3.org/2001/XMLSchema-instance"
 xsi:noNamespaceSchemaLocation="schema.xsd">
  <attack>left step-through cross push</attack>
  <stances>
    <attacker><stance side="right">neutral bow</stance></attacker>
    <defender><stance>natural</stance></defender>
  </stances>
  <steps>
    <step>
      <footManeuver side="left">step back</footManeuver> toward 6:00 into a
      <stance side="right">forward bow</stance> as you execute a
      <parry side="left">outward</parry> to the outside of your opponent's left arm.
    </step>
    <step>
      <footManeuver>pivot</footManeuver> into a <stance side="right">neutral bow</stance>
      as you execute a <strike side="right">inward diagonal hammer fist</strike> to your
      opponent's left kidney.
    </step>
    <step>
      <footManeuver>pivot</footManeuver> into a <stance side="right">forward bow</stance>
      as you execute a <punch side="right">outward back knuckle</punch> to your
      opponent's left ribs.
    </step>
    <step>
      Draw your left foot toward your right into a <stance side="right">cat</stance>
      stance.
    </step>
    <step>
      Execute a <kick side="right">downward looping roundhouse</kick> to the top of
      your opponent's left calf.
    </step>
  </steps>
</technique>
